,Title,Album,Language,Lyrics
66,High for Hours,,en,"This is called being high as shit, for hours
That's the name of this song, nigga
""High as Shit for Hours""
Here we go, yeah

American hypocrisy, oh, let me count the ways
They came here seekin' freedom then they end up ownin' slaves
Justified it usin' Christianity which saves
Religion don't mean shit, there's too much ego in the way
That's why ISIS is a crisis
But in reality, this country do the same shit
Take a life and call it righteous
Remember when bin Laden got killed, supposedly?
In a hotel lobby after a show, was noticin'
These white ladies watchin' CNN, coverin' the action
They read the headline and then they all started clappin'
As if LeBron had just scored a basket at the buzzer
I stood there for a second, watched them high-five each other
For real? I thought this was ""Thou shalt not kill""
But police still lettin' off on niggas in the Ville
Claimin' that he reached for a gun
They really think we dumb and got a death wish
Now somebody's son is layin' breathless
When I was a little boy my father lived in Texas
Pulled up in Toyota, drove that bitch like it was Lexus
Put my bag in his trunk and headed off for Dallas
Out there for the summer, feelin' just like I was Alice
Lost in the Wonderland where niggas still sufferin'
Just like they was back home, and that's wrong
So now it's fuck the government, they see my niggas strugglin'
And they don't give a fuck at all, and that's wrong, yeah

The type of shit that make you wanna
The type of shit that make you wanna let go
The type of shit that make you wanna
The type of shit that make you wanna let go

I had a convo with the President, I paid to go and see him
Thinkin' about the things I said I'd say when I would see him
Feelin' nervous, sittin' in a room full of white folks
Thinkin' about the black man plight, think I might choke
Nope, raised my hand and asked a man a question
Does he see the struggle of his brothers in oppression?
And if so, if you got all the power and the clout
As the President, what's keepin' you from helpin' niggas out?
Well, I didn't say ""nigga,"" but you catch my drift
He looked me in my eyes and spoke and he was rather swift
He broke the issues down and showed me he was well-aware
I got the vibe he was sincere and that the brother cared
But dawg, you in the chair, what's the hold-up?
He said, ""There's things that I wanna fix
But you know this shit, nigga: politics""
Don't stop fightin' and don't stop believin'
You can make the world better for your kids before you leave it
Change is slow, always has been, always will be
But fuck that, I'ma bust back 'til they kill me
Change is slow, always has been, always will be
But fuck that, I'ma bust back until they kill me—feel me?

The type of shit that make you wanna (Aight, third verse)
The type of shit that make you wanna let go
The type of shit that make you wanna
The type of shit that make you wanna let go

Here's a thought for my revolutionary heart
Take a deeper look at history, it's there to pick apart
See the people at the top, they get to do just what they want
'Til after a while the people at the bottom finally get smart
Then they start to holla, ""Revolution""
Tired of livin' here, destitution
Fuck that lootin', can you tell me what's the best solution?
I used to think it was to overthrow oppressors, see
If we destroy the system, that means we'll have less of greed
But see, it's not that simple
I got to thinkin' about the history of human nature
While this instrumental played, then I realized somethin' that made
Me wonder if revolution was really ever the way
Before you trip and throw a fit over these words I say
Think about this shit for a second, you heard the way
The children in abusive households grow up
Knockin' girlfriends out cold—that's called a cycle
Abused becomes the abuser and that's just how life go
So understand
You get the power, but you know what power does to man?
Corruption always leads us to the same shit again
So when you talk 'bout revolution, dawg, I hear just what you sayin'
What good is takin' over when we know what you gon' do?
The only real revolution happens right inside of you
I said what good is takin' over when we know what you gon' do?
The only real revolution happens right inside of you, nigga

The type of shit that make you wanna (High for hours, nigga)
The type of shit that make you wanna let go (Volume one)
The type of shit that make you wanna
The type of shit that make you wanna let go"
67,a p p l y i n g . p r e s s u r e,The Off-Season,en,"Yeah (Yeah)
Yeah, nigga (One two, one two, one)
The Off-Season (One two, one two, one two, one)
The Off-Season, nigga
We offing niggas (Ayy, that's right)
Fuck you talkin’ 'bout? (That's right, ayy)
Offing niggas (Yeah, hey, yeah)
(Vocal up a little more, hey)

Uh, applying pressure
Started my grind where crime festers
And nines showing like they in they second trimesters (Pregnant)
That’s why when niggas throw a shot or two online, I pay no mind to their benign gesturеs (Mm)
Nigga, please, I got my mind on much bigger things, to say thе least
My latest speeches sound like they was released by David East (What up, East?)
Verses hit hard, never pitched hard or played the streets
These niggas' whips hard, behind closed doors, can't pay the lease (Uh)
Ain't nothin' wrong with livin' check to check 'cause most have to (I understand that)
Instead of cappin', why don’t you talk ’bout bein' a broke rapper? (I don’t understand that)
That's a perspective I respect because it's real
What it's like to be nice as fuck but got to stress to pay the bills
That was me in ’08, seein' no cake
Not even on dates I celebrated my birth
Just did the mental math and calculated my worth
Shit crazy, didn't know I got more M's than a real Slim Shady video (I'm the real Shady)
Big Boss, less Rick Ross, more like a wavy Hideo
Kojima, they tote steamers around the way we tippy-toe
'Round crack vials and cold-blooded killers, no reptiles
Just projectiles from niggas salty you rockin' the fresher textiles
I seen best pals grow up and switch (I hate to see it)
Sometimes over a couple dollars, more often over a bitch (Ah, I hate to see it)
I can cap and say that I never scratched my jealousy's itch
But thank God I conquered that 'cause if not I'd never be rich
Envy keep your pockets empty, so just focus on you
If you broke and clownin' a millionaire, the joke is on you
Money ain't everything, I never say that (Never)
But niggas throw stones knowin' they sell they soul to get wherever they at (Come on, man)
Just know these verses is some shit they gon' forever playback, nigga (Come on, nigga)

Hell yeah (Ooh)
Fuck, you know what it is, nigga
Don't even— man
Niggas try to act like they don't—, bitch
That's why I gotta flex sometimes
'Cause niggas just try to act like you just not that motherfuckin' nigga, like
Like you just really don't do it how you do it
Like niggas will really try to act like you don't do what you do
Nigga look you dead in your face
And really act like you don't do it to the level that you do it
That's why sometimes you gotta come through and just do it at the level that you do it in front of every nigga face
So they know the difference between you, the real niggas, and the mothafuckin' fraudulent niggas, man
Don't never get it fucked up
If a nigga can't do it like you do it sometimes you gotta do it in front of his fuckin' face so he'll know forever
""Damn, that nigga did it how I always wanted to do it and I'll never be able to do it like that""
Bitch, it's a difference (Ah)
(
These are the same ones telling our people what we are and we aren't because we're just not working hard enough
And that mentality is what we're up against today
But this is good to know because this time, when we march on the Capitol
You can go ahead and let 'em know long before we get there, we're coming to get that check
)"
68,Too Deep for the Intro,Friday Night Lights,en,"Yeah
Ahem
Hey
Yeah

Partially functional, half of me is comfortable
The other half is close to the cliff like Mrs. Huxtable
These boys got them holsters and clips they pack like Lunchables
Like white boys in grade school
While we ate school-made food
Just eyeing they shit, wish I was trying they shit
Knowing when mama hit the store, she wasn't buying that shit
No, I ain't crying a bit, man, that's just life, that's how that shit work
You reach your hand in fire, you pull it back when you get burnt
Gotta learn when you get hurt, even if it's with Cupid
He beat you and you went back, you's officially stupid
Oh, yeah, I understand, that's your man, you had a plan
You've been together for some years, you sticking with him for the kids
So you overlook the tears, but we both know that's a bad look
'Cause twenty years from now, your daughter'll probably get her ass whooped
Look, if this too deep for the intro, I'll find another use
But just in case it's perfect, let me introduce, Cole

Time to save the world, where in the world is all the time?
So many things I still don't know (
Uh-uh, hey
), so many times I've changed my mind
Guess I was born to make mistakes
But I ain't scared to take the weight
So when I stumble off the path (
Yeah
)
I know my heart will guide me back (
Yeah
)

Man, is this too deep for the intro? If so, I'll find another use
But just in case it's perfect, let me introduce
It's Cole, I had a dream and so I made a move
An ill-ass nigga who just so happened to stay in school
Still rap for hustlers and motherfuckers that hated school
Said, ""That's for busters,"" then heard my shit and I made it cool
It's safe to say that I'm gifted as if I'm Christmas shopping
I got gangster niggas lining up in admissions office
Ayy, possibly 'cause all the hoes a nigga scraped
A lot of shit up on my plate, so you know a nigga late
To my first class, I'd much rather sit up in first class
Should I admit that a slutty bitch was my first smash?
Wasn't experienced, so nah, I didn't wear it out
Always thought my first time would be someone I cared about
But being a virgin was something to be embarrassed 'bout
I used that ass for practice, so I wasn't scared out my mind
You call them rhymes, I call it clearing out my mind
Was just a young boy staring out my blinds
'Til I got free from my mama leash
Running loose through the streets like a stray dog in heat
And we looking for some freaks, can you play? Pardon me
What's your name? Don't mistake me for no lame, no, not me
She knew I was on the team 'cause she seen how tall I be
In the club, dappin' niggas, eventually, RIP
Damn, you win some, you lose some, that's just how it happens
And if a nigga step up to you, then you gotta scrap him
Your name is all you got, throwing hands by the bathroom
It's funny, I barely told nobody I started rapping
'Cause, see, some niggas was haters that I just viewed as clowns
At fourteen, I knew I was the nicest dude around
I gotta make a move, I gotta do this now
If they don't know your dreams, then they can't shoot 'em down

Ha, yeah, nigga, hell yeah
I felt that one in my fuckin' soul, nigga

Ooh, hey
Ooh, hey
I'm trying to decide which way to go
Think I made a wrong turn back there somewhere
Ooh, hey
I'm trying to decide which way to go
Think I made a wrong turn back there somewhere"
69,Tribe,Milky Way,en,"This one's for you
This one's for you
I think I made it

I think I made it, I think I made it
'Cause I'm always smiling, and you are the reason now
Girl, I can't explain it
It's all in the timing, I had to get low
I had to get low
I had to get back, I had to report
I had to get facts 'cause you are just that, you that
Girl, you share your truths with me
And I find them true, a muse, you in the booth with me

Can't spend no time on the nickle and dime'n
I got me a girl, she don't want no diamonds
A daily reminder to holla at God
Like ""Where did you find her? Good looking, my nigga""
Everything 'round me I took it
Did it with only the niggas I knew
And a few niggas I thought I knew better
There go my bitches, I always do better
But, you're more top echelon
My next probably be a step backwards
Niggas front when they get struck with love
Like the drama majors, be the best actors
I'm done with all that tough acting
John Madden would've saw it happen, and so it happens
My niggas want life's good things, they still dreaming
And you deserve 'em too, I'ma do it just so it happens

I think I made it, I think I made it
'Cause I'm always smiling, and you are the reason now
Girl, I can't explain it
It's all in the timing, I had to get low, I had to get low
I had to get back, I had to report
I had to get facts 'cause you are just that, you that
You share your truths with me
And I find them true, a muse, you in the booth with me

La, la, la, la, la
La, la, la, la, la (This one's for you)
La, la, la, la, la
La, la, la, la, la (This one's for you)
La, la, la, la, la
La, la, la, la, la (I'm hella faded)
La, la, la, la, la (Yeah)
La, la, la, la, la
I'm hella faded, yeah

I'm hella faded, I'm hella faded
These niggas been hating, I don't know the reason now
Sometimes I feel jaded
They don't see the real me
They only know Cole, they only know Co-ole
I had to get back, I had to resort to turning my back
I'm doing just that, true that
I thought He was through with me, but that wasn't true
The proof? You in the coupe with me
God shuffled the cards, dealt me a hand with impossible odds
Put an obstacle course up
Look, and I conquered them all (Conquered them all)
With minimal effort I'm fresher than sock in your drawer (Fuck)
They spinning my records so heavy, I'm topping the Forbes
Stuck in a rock and a hard place though
Is it true what they say? The higher you go, the longer the fall?
Well, I dropped to the floor, the knock at the door was on cue
Uh, I thought that I saw it all 'til I saw you
Now I call you when the sun shines and the rain dries up
I'm a pit bull, but for you I be on chain tied up (One more time)
In the backyard with a muzzle on tail wagging like Oregon Trail
Waiting on you to come through just like you do, well

I think I made it, I think I made it, I think I made it
'Cause I'm always smiling, and you are the reason now
Girl, I can't explain it
It's all in the timing, I had to get low, I had to get low
I had to get back, I had to report
I had to get facts 'cause you are just that, you that
You share your truths with me
And I find them true, a muse, you in the booth with me

La, la, la, la, la
La, la, la, la, la (This one's for you)
La, la, la, la, la
La, la, la, la, la (This one's for you)
La, la, la, la, la
La, la, la, la, la (This one's for you)
La, la, la, la, la
La, la, la, la, la
I think I made it
I think I made it, I think I made it
I think I made it
'Cause I'm always smiling and you are the reason now"
70,Intro (2014 Forest Hills Drive),2014 Forest Hills Drive (10 Year Anniversary Edition),en,"Do you wanna, do you wanna be?
Do you wanna, do you wanna be?
Do you wanna, do you wanna be, free?
Do you wanna, do you wanna be, happy?
Do you wanna, do you wanna be, happy?
Do you wanna be, happy?
Do you wanna, do you wanna be, happy?
I said do you wanna, do you wanna be, happy?
I said do you wanna, do you wanna be, free?
I said do you wanna, do you wanna be happy?
I said do you wanna, do you wanna be, free?

Free from pain, free from scars
Free to sing, free from bars
Free my dawgs, you're free to go
Block is hot, the streets is cold
Free to love, to each his own
Free from bills, free from pills
You roll it loud, the speakers blow
Life get hard, you ease your soul
It cleanse ya mind, learn to fly
Then reach the stars, you take the time
To look behind and say, ""Look where I came
Look how far I done came""
They say that dreams come true
And when they do, that there's a beautiful thing

Now do you wanna, do you wanna be happy?
I said do you wanna, do you wanna be free?
I said do you wanna, do you wanna be?"
71,Port Antonio,,en,"Ride to it, ride to it
Ride to it, ride to it
Ride to it, ride to it
Ride to it, ride to it, uh
Ride to it, ride to it
Ride to it, ride to it
Ride to it, ride to it
Ride to it (Uh)

Young Jermaine walked the straight and narrow
Minimum-wage jobs for dinero, but still, my mind was on the zeros
I fiend for the perks that was seen flippin' birds, so
We was skippin' church, but my eyes was on the sparrows
Niggas flippin' pies, spendin' thousands on apparel
Shit, I wanna shine too, I want dimes too
Jealous niggas wanna know just how my rhymes blew
Mano y mano, I'm Bono, I'm you times two
Now I'm bougie, I done outgrew the fountain blue
But never forgot the spot where I developed my plot
To dwell at the top, the Ville, where all my skeletons locked
If I could do it all over, then I never would swap
I've seen good, I've seen bad, had my melanin mocked
I've seen lifelong friends turn to devilish opps
I was Mike in red leather, tryna tell him to stop
You better beat it 'fore you see the heavy-metal get popped
He was a mean-ass wing with a hell of a shot
But if no team draft King, he gon' bet on the block
He wanna ball 'til he fall or 'til the federals knock
And sit his ass on a bench for movin' careless with rock
You can't relate, 'less your father was not around
And your mother went out and found someone else and then brought them 'round
And they salaries then combine, when they married, when it brought you out
Of that poverty, then you moved to a soft little part of town
So that when you back in the hood, you feel awkward about it now (Damn)
Then your confidence start to drown
But the rappin' gave you some positive thoughts, so you jot 'em down
You jot 'em down

Ride to it, ride to it
Ride to it, ride to it
Ride to it, ride to it
Ride to it, ride to it, uh

Y'all niggas ain't stoppin' me
Y'all niggas ain't stoppin' me
Y'all niggas ain't stoppin' me
Y'all niggas ain't stoppin' me
Y'all niggas ain't stoppin' me
Y'all niggas ain't stoppin' me
Y'all niggas ain't stoppin' me
Yeah, uh

Benjamin Button, Cole flows reverse time
To find deliveries good as mine, you gotta search primes
I'm scaling heights higher than birds can perch
Tryin' to be somethin', hopin' that peace comes to my cursed mind
One thing's for sure, that I've matured from my first rhyme
I learned long ago, you can't please 'em all, and it hurts tryin'
In this game, where all you've got is your name
Like Durk, I'm smirkin' at niggas tryna besmirch mine
Absurd times, where the fake get toted as wise
I can see hate in both of your eyes, but the third's blind
So you search lines, but you struggle
Which explains the puzzled look on the dull face as the word finds
I hate what rap's become, but like do-not-disturb signs
Can't knock it if I see it's 'bout the dough
They instigate the fuckery because it's profitable
But singin' ""stop the violence"" tunes when dudes in hospitals
I pulled the plug because I've seen where that was 'bout to go
They wanted blood, they wanted clicks to make they pockets grow
They see this fire in my pen and think I'm dodgin' smoke
I wouldn't have lost a battle, dawg, I woulda lost a bro
I woulda gained a foe, and all for what? Just to attain some mo'
Props from strangers that don't got a clue what I been aimin' for?
Since the age of fourteen, Jermaine is no king
If that means I gotta dig up dirt and pay the whole team
Of algorithm-bot niggas just to sway the whole thing
On social media, competin' for your favorable memes
To be considered best or live and rest? The weight of both things
I understand the thirst of being first that made 'em both swing
Protecting legacies, so lines got crossed, perhaps regrettably
My friends went to war, I walked away with all they blood on me
Now some will discredit me, try wipe away my pedigree
But please, find a nigga out that's rappin' this incredibly, uh
My dawg texted me, I'll share the words he said to me
""If you refuse to shoot the gun, don't mean the gun ain't deadly,"" uh
I guess in that metaphor, hypothetically, the gun is me
I text him back like, ""Guess a gun ain't what I'm tryna be, my nigga""
They stripped me of my spot, and now I'm finally free, my nigga
They say I'm pickin' sides, ayy, don't you lie on me, my nigga
Then start another war, ayy, Drake, you'll always be my nigga
I ain't ashamed to say you did a lot for me, my nigga
Fuck all the narratives
Tappin' back into your magic pen is what's imperative
Remindin' these folks why we do it, it's not for beefin'
It's for speakin' our thoughts, pushin' ourselves, reachin' the charts
Reaching your minds, keepin' your hearts, creepin' to find
Emotions to touch, somethin' inside to open you up
Help you cope with the rough times and shit
I'm sendin' love 'cause we ain't promised shit
My nigga

Y'all niggas ain't stoppin' me (Yeah, 
know that you are loved
)
Y'all niggas ain't stoppin' me (Y'all niggas, 
ooh
)
Y'all niggas ain't stoppin' me
Y'all niggas ain't stoppin' me (Even if you don't love yourself)
Y'all niggas ain't stoppin' me
Y'all niggas ain't stoppin' me
Y'all niggas ain't"
72,h u n g e r . o n . h i l l s i d e,The Off-Season,en,"Alright now, alright now
God has a plan for you
And all you've got to do is believe, believe, believe
Yeah

Shit gon' get hard, keep your head strong
If I quit now, then I'm dead wrong
Fightin' off this hunger for hours
Big stepper, nigga, don't get stepped on
The money might fade, but respect don't
Still gon' be me when success gone
I don't speak the language of cowards
I walk through the flame like I'm Teflon

I sucked up the pain and I kept goin'
Whole world know my namе, bitch, my rep strong
We sold out in less than a hour
Thеse words I still sang like I'm slept on
I sin, so I can't cast the next stone
Unless it's baguettes 'round my neck bone
Inside of my frame lies a power
You can't get this game from no TED Talk
I wanna know if they understand me
I put it all on A, ain't no plan B
Hopin' all this weight ain't gon' drown me
Fucked around, got grey hairs already
Runnin' up the stairs on a tower
Runnin' up these Ms by the hour
If I drop a gem, money showers
When you get your taste, they get sour

Shit gon' get hard, keep your head strong
Just keep your head strong
The money might fade, but respect don't
The ultimate price is regret now
Still gon' be me when success gone
Still gon' be me, ahh-ahh-ahh
Big stepper, nigga, don't get stepped on

Waitin' my turn like grains of sand inside a hourglass
Mainly concerned back in the day with how long I would last
Make a few thousand dollars stack with every hour passed
I catch you playin' inside my lane and I'ma foul your ass
Put the whole game on top my back, don't need no chiropract'
They callin' me young PWC, I got my power back
Ain't fuckin' around, beefin' with me gon' get you hollered at
Niggas can't see me one-on-one, that's word to Kyla Pratt
You hittin' them weights, congratulations 'cause you built somethin'
You takin' a lot of boxin' lessons, but you still pussy
I see right through you niggas just like 2Pac hologram
Ain't doin' Coachella, bookin' me gon' be a lot of Ms
I'm feeling myself, I'm building my wealth up 'til it's towerin'
I put my tongue all in my bitch, she get to hollerin'
I ain't doin' no dirt no more, I stopped creepin' six years ago
Fun fuckin' them hoes until you realize that you is the ho

Shit gon' get hard, keep your head strong
If I quit now then I'm dead wrong
Fightin' off this hunger for hours
Big stepper, nigga, don’t get stepped on
The money might fade, but respect don't
Still gon' be me when success gone
I don't speak the language of cowards
I walk through the flame like I'm Teflon

Can't be afraid of sunlight (Sunlight)
Spotlights when it glows (It glows)
All the pain you hold
Makes you worth your weight in gold
Can't be afraid of sunlight (Sunlight)
Spotlights when it glows (It glows)
All the pain you hold
Makes you worth your weight in gold
God has a plan for you
And all you've got to do is believe, believe, be—"
73,St. Tropez,2014 Forest Hills Drive (10 Year Anniversary Edition),en,"Roll up and smoke my sins away
I'd like to go to St. Tropez
Maybe I'll go, maybe I'll stay (
Maybe I'll stay
)
She asked me if I'm scared to fly
To tell the truth, I'm terrified
I never been that high before
Very bad reason not to go
Terrible reason not to go

He's on his way, he's 'bout to get paid
He's on his way to Hollywood
He's on his way, he's 'bout to get paid
He's on his way to Hollywood
Show him the way, he's 'bout to get paid
He's on his way to Hollywood
He's on his way, he's 'bout to get paid
He's on his way to Hollywood

Ayy, from the door I showed you my scars
And I told you girl, ""I won't lie-ie-ie""
If we at war, then this is a war
That I can't afford, no I, I, I
I wanted more but that was before
Lord knows I'm torn, so I–I cry (No I, I, I)
From the corner of my eye, baby
It's been hard for me to smile-ile
Lately, it's been hard for me to smile-ile
Lately, it's been hard for me to smile-ile
Lately, it's been hard for me to smile

Ooh, ooh, ooh
Ooh, ooh, ooh
If you won't take me in your home
If you won't take me in your home
If you won't take me in your home
If you won't take me in your home

He's on his way, he's 'bout to get paid
He's on his way to Hollywood
He's on his way, he's 'bout to get paid
He's on his way to Hollywood
Show him the way, he's 'bout to get paid
He's on his way to Hollywood
He's on his way, he's 'bout to get paid
He's on his way to Hollywood"
