,Title,Album,Language,Lyrics
0,No Role Modelz,2014 Forest Hills Drive (10 Year Anniversary Edition),en,"First things first: rest in peace, Uncle Phil
For real
You the only father that I ever knew
I get my bitch pregnant, I'ma be a better you
Prophecies that I made way back in the Ville
Fulfilled
Listen, even back when we was broke, my team ill
Martin Luther King woulda been on Dreamville, talk to a nigga

One time for my L.A. sisters
One time for my L.A. ho
Lame niggas can't tell the difference
One time for a nigga who know

Don't save her, she don't wanna be saved
Don't save her, she don't wanna be saved
Don't save her, she don't wanna be saved
Don't save her, she don't wanna be saved

No role models, and I'm here right now
No role models to speak of
Searchin' through my memory, my memory, I couldn't find one
Last night, I was gettin' my feet rubbed by the baddest bitch
Not Trina, but I swear to God, this bitch'll make you call your girl up
And tell her, ""Hey, what's good?
Sorry, I'm never comin' home, I'ma stay for good""
Then hang the phone up and proceed to lay the wood
I came fast like 9-1-1 in White neighborhoods
Ain't got no shame 'bout it
She think I'm spoiled and I'm rich 'cause I can have any bitch
I got defensive and said, ""Nah, I was the same without it""
But then I thought back, back to a better me
Before I was a B-list celebrity
'Fore I started callin' bitches ""bitches"" so heavily
Back when you could get a platinum plaque without no melody, you wadn't sweatin' me

One time for my L.A. sisters
One time for my L.A. ho
Lame niggas can't tell the difference
One time for a nigga who know

Don't save her, she don't wanna be saved
Don't save her, she don't wanna be saved
Don't save her, she don't wanna be saved
Don't save her, she don't wanna be saved

I want a real love, dark-skinned Aunt Viv love
That Jada and that Will love
That leave a toothbrush at your crib love
And you ain't gotta wonder whether that's your kid love
Nigga, I don't want no bitch from reality shows
Out-of-touch-with-reality hoes
Out in Hollywood bringin' back five or six hoes
Fuck 'em then we kick 'em to the do', nigga, you know how it go
She deserved that, she a bird, it's a bird trap
You think if I didn't rap she would flirt back?
Takin' off her skirt, let her wear my shirt 'fore she leave
""I'ma need my shirt back"" (Nigga, you know how it go)

One time for my L.A. sisters
One time for my L.A. ho
Lame niggas can't tell the difference
One time for a nigga who know

Don't save her, she don't wanna be saved
Don't save her, she don't wanna be saved
Don't save her, she don't wanna be saved
Don't save her, she don't wanna be saved

There's an old saying in Tennessee—I know it's in Texas, probably in Tennessee—that says, fool me once... shame on... shame on you
Fool me—can't get fooled again

Fool me one time, shame on you (Ayy)
Fool me twice, can't put the blame on you (Ayy)
Fool me three times, fuck the peace sign
Load the chopper, let it rain on you (Bop, bop, bop)
Fool me one time, shame on you (Ayy)
Fool me twice, can't put the blame on you (Ayy)
Fool me three times, fuck the peace sign
Load the chopper, let it rain on you (Bop, bop, bop)

My only regret was too young for Lisa Bonet
My only regret was too young for Nia Long
Now all I'm left with is hoes from reality shows
Hand her a script, the bitch prolly couldn't read along
My only regret was too young for Sade Adu
My only regret, could never take Aaliyah home
Now all I'm left with is hoes up in Greystone
With the stale face 'cause they know it's they song

She shallow but the pussy deep (She shallow, she shallow)
She shallow but the pussy deep (She shallow), yeah, ayy
(She shallow)
She shallow but the pussy deep (She shallow), haha
(She shallow)
She shallow but the pussy deep (She shallow, she shallow)

Don't save her, she don't wanna be saved
Don't save her, she don't wanna be saved
Don't save her, she don't wanna be saved
Don't save her, she don't wanna be saved
Don't save her, she don't wanna be saved
Don't save her, she don't wanna be saved
Don't save her, she don't wanna be saved
Don't save her, she don't wanna be saved"
1,She Knows,Born Sinner (Deluxe Version),en,"She knows
She knows, ayy
Bad things happen to the people you love
And you find yourself praying up to Heaven above
But honestly, I never had much sympathy
'Cause those bad things, I always saw them coming for me
I'm gonna run, run away, run
 (Oh, I), 
run away, run away
 (Oh, I, I, I)
Run away and never come back
 (Well, alright)
Run, run away, run, run away
 (Oh, I), 
run away
 (Oh, I, I, I)
Show 'em that your color is black
 (Well, alright)

Damned if I do, damned if I don't
You know I got a girl back home
You got a man, what you want?
What you want?
What these bitches want from a nigga?
On some DMX shit, huh
I know them other niggas love tricking
On some BMX shit, but not me
Now I'm sure you done heard about me
A black star, Mos Def, Kweli
Good, so them bad hoes try me, they try me, huh
This is Martin Luther King in the club, gettin' dubs, huh
With a bad bitch in his ear, sayin' that she down for whatever
In the back of his mind is Coretta

And she knows, she knows
And I know she knows, and I know she knows
And deep down, she knows, she knows
And I know she knows, and I know she knows
Well, alright, 
oh, I, oh, I, I, I
I can't be what you want from me, well, alright
Oh, I, oh, I, I, I
I can't be what you want from me, well, alright

Damned if I do (Shit), damned if I don't (Uh)
I'm passing up on bad hoes
Tryna be the man that she want, what she want?
What, what she want from a nigga?
To put a ring on it, uh
Got a bitch on my dick right now
And she just wanna sing on it, oh, huh
Got me up so high, try and get a piece of that apple pie, uh
I be up so high, try and get a piece of that apple pie
Dancehall vibe with my pants on fire
'Cause I told her I was 'sleep, 'cause I
Creep with this pretty young thing that I cho'
'Cause she could be doing the same thing, I suppo'

And she knows, she knows
And I know she knows, and I know she knows
And deep down, she knows, she knows
And I know she knows, and I know she knows
Well, alright, 
oh, I, oh, I, I, I
I can't be what you want from me, well, alright
Oh, I, oh, I, I, I
I can't be what you want from me, well, alright

Niggas say, ""Turn up,"" hoes say, ""Turn up""
Only bad thing 'bout a star is they burn up
Niggas say, ""Turn up,"" hoes say, ""Turn up""
Only bad thing 'bout a star is they burn up
Rest in peace to Aaliyah
Rest in peace to Left Eye (Left Eye)
Michael Jackson, I'll see ya
Just as soon as I die (I die)

Got me up so high
Try and get a piece of that apple pie, uh
I be up so high
Try and get a piece of that apple pie
Got me up so high
Try and get a piece of that apple pie, uh
I be up so high
Try and get a piece of that apple pie

Well, alright, 
oh, I, oh, I, I, I
I can't be what you want from me, well, alright
Oh, I, oh, I, I, I
I can't be what you want from me, well, alright

Run away, run away—, back (
Oh-oh-oh, oh-oh-oh-oh-oh-oh
)
Run away, run away—, back (
Oh-oh-oh, oh-oh-oh-oh-oh-oh
)
Run away, run away—, back (
Oh-oh-oh, oh-oh-oh-oh-oh-oh
)
Run away, run away—, back (
Oh-oh-oh, oh-oh-oh-oh-oh-oh
)"
2,Power Trip,Born Sinner (Deluxe Version),en,"Got me up all night
All I'm singin' is love songs
She got me up all night
Constant drinkin' and love songs
She got me up all night
Down-and-out with these love songs
She got me up all night
Drownin' out with these love songs
She got me up all night (Yeah)
All I'm singin' is love songs
She got me up all night (Yeah)
Constant drinkin' and love songs
She got me up all night (Yeah)
Down-and-out with these love songs
She got me open all night (Uh-huh)
Got me open all night, hey

Okay, back when I was sleeping in my mama crib
Or even back when I was up there in Mohammed crib
Paying seventeen hundred for the rent, money well spent
No heater, but a nigga made heat, may I vent?
Had a thing for ya, even wrote the song ""Dreams"" for ya
‘Cause I had dreams for ya, thoughts of a ring for ya
Childish shit, you know child and shit
Anonymous flowers sent, you know coward shit
Now a nigga signed to Hov, took a power trip
Back home, I'm grown now, and the city's my throne now, huh
The same clubs that I used to get tossed out
Life got Kriss Kross'd: totally crossed out
‘Cause now I'm in this bitch and I'm totally bossed out
Old chicks crying ‘cause they know that they lost out
But I'm still on you, I'm still on you
My drink spill on me, while I feel on you, I'm sayin'—

Would you believe me if I said I'm in love?
Baby, I want you to want me
Would you believe me if I said I'm in love?
Baby, I want ya

And we are, we are, we are
Got me up all night
And we are, we are, we are
All I'm singin' is love songs
And we are, we are, we are
Got me up all night
And we are, we are, we are (She got me)
And we are, we are, we are (She got me)

Well, this has got to be the longest crush ever
If I ever get to fuck it'd be the longest bust ever
Love is a drug, like the strongest stuff ever and
Fuck it, I'm on one, you feel me?
She on a power trip, she got me where she want a nigga
Wife'ing in the club, man, my homies gon' disown a nigga
Like, ""Give me twenty dollars, dollars!""
Ass stupid, how you get to college, college?
I'm in your city and I'm wonderin' if you're home now
Went and found a man, but I'm hopin' you're alone now
Can't help but feeling like I dropped the ball, cliché
I used to pop up on you at the mall each day
Now, typically I kick game like Eastbay
But you got a nigga freeze-framed yelling: ""Please play!""
For Pete's sake, homie, pull it together
Just fuck her one time and be through with forever, but—

Would you believe me if I said I'm in love?
Baby, I want you to want me
Would you believe me if I said I'm in love?
Baby, I want ya, yeah

And we are, we are, we are
Got me up all night
And we are, we are, we are
All I'm singin' is love songs
And we are, we are, we are
Got me up all night
And we are, we are, we are (She got me)
And we are, we are, we are (She got me)

Got me up all night (All night)
All I'm singin' is love songs
She got me up all night (All night)
Constant drinkin' and love songs
She got me up all night (All night)
Down-and-out with these love songs
She got me up all night (All night)
Drownin' out with these love songs
She got me up all night (Yeah)
All I'm singin' is love songs
She got me up all night (Yeah)
Constant drinkin' and love songs
She got me up all night (Yeah)
Down-and-out with these love songs
She got me open all night (Uh-huh)
Got me open all night, hey

Back when I was sleeping in my mama crib
*Space Bar Tap*"
3,Wet Dreamz,2014 Forest Hills Drive (10 Year Anniversary Edition),en,"Cole
Cole world
Yeah
Let me take y'all back, man
As I do so well
Wadn't nuttin' like that
Man, it wadn't nuttin' like that

First time, she was in my math class (Uh-huh)
Long hair, brown skin with the fat ass
Sat beside me, used to laugh, had mad jokes
The teacher always got mad, so we passed notes
It started off so innocent
She had a vibe and a nigga started diggin' it, uh
I was a youngin, straight crushin', tryna play the shit cool
But a nigga couldn't wait to get to school, ‘cause when I seen
Them thighs on her and them hips on her and them lips on her
Got me daydreamin', man, what
I'm thinkin' how she rides on it, if she sits on it, if she licks on it
Make it hard for me to stand up, as time goes by
Attractions gettin' deep and
Wet dreamin', thinkin' that I'm smashin' but I'm sleepin', I want it bad
And I ain't never been obsessed before
She wrote a note that said, ""You ever had sex before?"" Damn…

And I ain't never did this before, no
And I ain't never did this before, no
And I ain't never did this before, no
And I ain't never did this before, no
And I ain't never did this before, no
I ain't never did this before, no
And I ain't never did this before, no
And I ain't never did this before, no

I wrote back and said
""Of course I had sex before,"" knowin' I was frontin'
I said, ""I'm like a pro, baby,"" knowin' I was stuntin'
But if I told the truth, I knew that I'd get played out, son
Hadn't been in pussy since the day I came out one, but
She don't know that, so she done wrote back and told me
""Oh, you a pro, homie? Well, I want you to show me
My mama gone for the weekend
So Saturday, baby, we can get to freakin'.""
That's when my heart start racin' and my body start sweatin'
Baby, you done woke my lil' man up
I'm thinkin' how that body look naked when you layin' on the bed
Teacher, please, don't make me stand up, I wrote back like
""Yeah, baby, sound like a plan.""
Still tryna play it cool, sound like the man
But I was scared to death, my nigga, my stomach turnin'
Talkin' shit, knowin' damn well I was a virgin, fuck

And I ain't never did this before, no
And I ain't never did this before, no
And I ain't never did this before, no
And I ain't never did this before, no
And I ain't never did this before, no
I ain't never did this before, no
And I ain't never did this before, no
And I ain't never did this before, no

Yeah, you know that feelin' when you
Know you finna bone for the first time?
I'm hopin' that she won't notice it's my first time
I'm hopin' that my shit is big enough to fuck wit'
And most of all I'm prayin', ""God, don't let me bust quick""
I'm watchin' pornos, tryna see just how to stroke right
Practice puttin' condoms on—how it go? Right
I'm in her crib, now a nigga palm sweatin'
With a pocket full of rubbers and an erection
That's when my hands start touchin' and her face start blushin'
And a nigga roll over on top and then she
Get my pants unbuckled and her hands start rubbin'
On me, ooh girl, don't stop, it's time for action
Pull out the condoms real smooth, yeah, just how I practiced
But right before I put it in, she flinched and grabbed it and said
""I wanna get somethin' off my mental
I can tell you're a pro, but baby, be gentle, ‘cause—""
‘Cause I ain't never did this before, no
And I ain't never did this before, no
And I ain't never did this before, no
And I ain't never did this before, no
And I ain't never did this before, no
I ain't never did this before, no
And I ain't never did this before, no
And I ain't never did this before, no"
4,Love Yourz,2014 Forest Hills Drive (10 Year Anniversary Edition),en,"Hm, love yours
Hm, love yours
No such thing

No such thing as a life that's better than yours
No such thing as a life that's better than yours (Love yours)
No such thing as a life that's better than yours
No such thing, no such thing

Heart beatin' fast, let a nigga know that he alive
Fake niggas mad, snakes
Snakes in the grass let a nigga know that he arrived
Don't be sleepin' on your level
'Cause it's beauty in the struggle, nigga (Beauty, beauty)
Goes for all y'all (Eh, rah, eh, rah)
It's beauty in the struggle, nigga (Beauty, beauty)
Let me explain, yeah

It's beauty in the struggle, ugliness in the success
Hear my words and listen to my signal of distress
I grew up in the city and know sometimes we had less
Compared to some my niggas down the block, man, we were blessed
And life can't be no fairy tale, no once upon a time
But I be goddamned if a nigga don't be tryin'
So tell me, Momma please, why you be drinkin' all the time?
Does all the pain he brought you still linger in your mind?
'Cause pain still lingers on mine
On the road to riches, listen, this is what you'll find
The good news is, nigga, you came a long way
The bad news is, nigga, you went the wrong way
Think bein' broke was better

No such thing as a life that's better than yours (Ha)
No such thing as a life that's better than yours (Think bein' broke was better)
No such thing as a life that's better than yours
(Think bein' broke was better, yeah) No such thing, no such thing

For what's money without happiness?
Or hard times without the people you love?
Though I'm not sure what's 'bout to happen next
I ask for strength from the Lord (Man) up above
'Cause I been strong so far, but I can feel my grip loosenin'
Quick, do somethin' before you lose it for good, get it back and use it for good
And touch the people how you did like before
I'm tired of livin' with demons 'cause they always invitin' more
Think bein' broke was better, now I don't mean that phrase with no disrespect
To all my niggas out there livin' in debt
Cashin' minimal checks, turn on the TV, see a nigga Rolex
And fantasize about a life with no stress
I mean this shit sincerely, and as a nigga who was once in your shoes
Livin' with nothin' to lose, I hope one day you hear me
Always gon' be a bigger house somewhere, but nigga, feel me
Long as the people in that motherfucker love you dearly
Always gon' be a whip that's better than the one you got
Always gon' be some clothes that's fresher than the ones you rock
Always gon' be a bitch that's badder out there on the tours
But you ain't never gon' be happy 'til you love yours

No such thing as a life that's better than yours (Love yours)
No such thing as a life that's better than yours (Love yours)
No such thing as a life that's better than yours (Love yours)
No such thing, no such thing

Heart beatin' fast, let a nigga know that he alive ('Live, 'live, 'live)
Fake niggas mad, snakes
Snakes in the grass let a nigga know that he arrived ('Rived, rived, rived)"
5,Crooked Smile,Born Sinner (Deluxe Version),en,"[Chorus: T-Boz, Chilli & 
Jennifer Hudson
]
Even though I—
On my way, on my way, on my way down
On my way, on my way, on my way down
You were the one that was tryna keep me way down
But like the sun, know you know I find my way back round

They tell me I should fix my grill 'cause I got money now
I ain't gon' sit around and front like I ain't thought about it
A perfect smile is more appealing, but it's funny how
My shit is crooked—look at how far I done got without it!
I keep my twisted grill, just to show the kids it's real
We ain't picture perfect, but we worth the picture still
I got smart, I got rich and I got bitches still
And they all look like my eyebrows: thick as hell
Love yourself, girl, or nobody will
Though you a woman I don't know how you deal
With all the pressure to look impressive and go out in heels
I feel for you, killin' yourself to find a man that'll kill for you
You wake up, put makeup on
Stare in the mirror, but it's clear that you can't face what's wrong
No need to fix what God already put his paintbrush on
Your roommate yelling, ""Why you gotta take so long?!""
What it's like to have a crooked smile
[Chorus: T-Boz, Chilli & 
Jennifer Hudson
 (
J. Cole
)]
Even though I—
On my way, on my way, on my way down
On my way, on my way, on my way down (This crooked smile)
You were the one that was tryna keep me way down
But like the sun, know you know I find my way back round (Yeah)

To all the women with the flaws, know it's hard, my darling
You wonder why you're lonely and your man's not calling
You keep falling victim 'cause you're insecure
And when I tell you that you're beautiful, you can't be sure
'Cause he don't seem to want you back and it's got you askin'
So all you see is what you lackin', not what you packin'
Take it from a man that loves what you got
And baby girl, you a star, don't let 'em tell you you're not
Now is it real? Eyebrows, fingernails, hair
Is it real? If it's not, girl, you don't care
'Cause what's real is somethin' that the eyes can't see
That the hands can't touch, that them broads can't be
And that's you, never let 'em see your frown
And if you need a friend to pick you up, I'll be around
And we can ride with the windows down, the music loud
I can tell you ain't laughed in a while
But I wanna see that crooked smile
[Chorus: T-Boz, Chilli & 
Jennifer Hudson
]
Even though I—
On my way, on my way, on my way down
On my way, on my way, on my way down
You were the one that was tryna keep me way down
But like the sun, know you know I find my way back round

We got the crooked smile, we can style on 'em
Back round
, crooked smile, we can style on 'em
You were the one that was tryna keep me way down
But like the sun, know you know I find my way back round

We don't look nothin' like the people on the screen
You know, the movie stars, picture perfect beauty queens
But we got dreams and we got the right to chase 'em
Look at the nation
That's a crooked smile braces couldn't even straighten
Seem like half the race is either on probation or in jail
Wonder why we inhale, 'cause we in Hell already
I ask: If my skin pale, would I then sell like Eminem or Adele?
But one more time for the 'Ville
And fuck all of that beef shit, nigga, let's make a mil'
Hey officer man, we don't want nobody gettin' killed
Just open up that cell, let my brother outta jail
I got money for the bail now, and well now
If you askin' will I tell now—ayy, hell nah
I ain't snitchin' 'cause, man, they get them niggas stitches now
If you was around then you wouldn't need a witness now
How you like this crooked smile?
[Chorus: T-Boz, Chilli & 
Jennifer Hudson
 (
J. Cole
)]
Even though I—
On my way, on my way, on my way down
On my way, on my way, on my way down (That crooked smile)
You were the one that was tryna keep me way down
But like the sun, know you know I find my way back round

We got the crooked smile, we can style on 'em
Back round
, crooked smile, we can style on 'em
You were the one that was tryna keep me way down
But like the sun, know you know I find my way back round


La la la, la la la, la-la—la—la
La la la, la la la, la-la—la—la
La la la, la la la, la-la—la—la
La la la, la la la, la-la—la—la
On my way, on my way, on my way down
On my way, on my way, on my way down
You were the one that was tryna keep me way down
But like the sun, know you know I find my way back round
Back round
You were the one that was tryna keep me way down
But like the sun, know you know I find my way back round
Back round
You were the one that was tryna keep me way down
But like the sun, know you know I find my way back round
Round"
6,MIDDLE CHILD,Revenge of the Dreamers III: Director’s Cut,en,"You good, T-Minus?

Niggas been countin' me out
I’m countin' my bullets, I'm loadin’ my clips
I'm writin' down names, I'm makin' a list
I'm checkin' it twice and I'm gettin’ ’em hit
The real ones been dyin', the fake ones is lit
The game is off balance, I’m back on my shit
The Bentley is dirty, my sneakers is dirty
But that's how I like it, you all on my dick

I'm all in my bag, this hard as it get
I do not snort powder, I might take a sip
I might hit the blunt, but I'm liable to trip
I ain’t poppin' no pill, but you do as you wish
I roll with some fiends, I love 'em to death
I got a few mil' but not all of them rich
What good is the bread if my niggas is broke?
What good is first class if my niggas can't sit?
That's my next mission, that's why I can't quit
Just like LeBron, get my niggas more chips
Just put the Rollie right back on my wrist
This watch came from Drizzy, he gave me a gift
Back when the rap game was prayin' I'd diss
They act like two legends cannot coexist
But I'd never beef with a nigga for nothin'
If I smoke a rapper, it's gon' be legit
It won't be for clout, it won't be for fame
It won't be 'cause my shit ain't sellin' the same
It won't be to sell you my latest lil' sneakers
It won't be 'cause some nigga slid in my lane
Everything grows, it's destined to change
I love you lil' niggas, I'm glad that you came
I hope that you scrape every dollar you can
I hope you know money won't erase the pain
To the OGs, I'm thankin' you now
Was watchin' you when you was pavin' the ground
I copied your cadence, I mirrored your style
I studied the greats, I'm the greatest right now
Fuck if you feel me, you ain't got a choice
I ain't do no promo, still made all that noise
This year gon' be different, I set my intentions
I promise to slap all that hate out your voice

Niggas been countin' me out
I'm countin' my bullets, I'm loadin' my clips
I'm writin' down names, I'm makin' a list
I'm checkin' it twice and I'm gettin' 'em hit
The real ones been dyin', the fake ones is lit
The game is off balance, I'm back on my shit
The Bentley is dirty, my sneakers is dirty
But that's how I like it, you all on my dick

I just poured somethin' in my cup
I've been wantin' somethin' I can feel
Promise I am never lettin' up
Money in your palm don't make you real
Foot is on they neck, I got 'em stuck
I'ma give 'em somethin' they can feel
If it ain't 'bout the squad, don't give a fuck
Pistol in your hand don't make you real

I'm dead in the middle of two generations
I'm little bro and big bro all at once
Just left the lab with young 21 Savage
I'm 'bout to go and meet Jigga for lunch
Had a long talk with the young nigga Kodak
Reminded me of young niggas from 'Ville
Straight out the projects, no fakin', just honest
I wish that he had more guidance, for real
Too many niggas in cycle of jail
Spending they birthdays inside of a cell
We coming from a long bloodline of trauma
We raised by our mamas, Lord, we gotta heal
We hurting our sisters, the babies as well
We killing our brothers, they poisoned the well
Distorted self-image, we set up to fail
I'ma make sure that the real gon' prevail, nigga

I just poured somethin' in my cup
I've been wantin' somethin' I can feel
Promise I am never lettin' up
Money in your palm don't make you real
Foot is on they neck, I got 'em stuck
I'ma give 'em somethin' they can feel
If it ain't 'bout the squad, don't give a fuck
Pistol in your hand don't make you real

Money in your palm don't make you real
Pistol in your hand don't make you real
Money in your palm don't make you real"
