,Title,Album,Language,Lyrics
206,The Storm,,en,"My man, Shawn, from around the way, son, been down from day one
Never been known for mistakes but was bound to make one
Her name was Nina, see he was all about the cash flow
'Til she came and had this man pussy whipped to the max yo
A true dime piece, describin' her, brown eyes
Caramel skin, thick thighs, goes beyond speech
But besides looks her mind's lost
Known for kickin' cats to the curb, leaving their hearts on the sidewalk
Shawn was one of them, she said she was lovin' him
But only fucked him because he had some funds comin' in
He couldn't see it though
She was cheating and he didn't even know
He even bought a crib with this schemin ho
In the ride, mad jewels, mad clothes, mad shoes
And to show his commitment he got her name tattooed
I gotta hand it to her, she had the stuff planned out
But watch what happened when her luck ran out

What goes around comes around
What goes up must come down
You up now but you'll get yours
Somehow, some day
In some way, shape, or form
Revenge is coming
No way to escape the storm
What goes around comes around
What goes up must come down
You up now but you'll get yours
Somehow, some day
In some way, shape, or form
Revenge is coming
No way to escape the storm

Time passes, Shawn is thinking about wedding rings
But he knows the signs of cheating and doesn't wanna believe them
He disregards them, goes out for diamond ring shopping
Now the big question is, when is he gonna pop it?
Waiting for the right time
Meanwhile Nina's the same ho
Like a snare drum but bangs way more
For Shawn up to this point shit's going well
'Til one day his homeboy hit him on his cell, like
""Yo son you won't believe this, I just seen your chick."" (""Where?"")
""In the mall with this cat, he was palming her ass
I swear to God son. Need me to run up on him and drop him?""
""Nah, chill I got this, I'll hit you back if it's poppin'""
He hung up, I called Nina, ""Where you at? What you doing?""
""At the mall with some friends buying new Timbs.""
Somethin' sounded funny
She was lying for sure
But Shawn had a little plot of his own
Check it

What goes around comes around
What goes up must come down
You up now but you'll get yours
Somehow, some day
In some way, shape, or form
Revenge is coming
No way to escape the storm
What goes around comes around
What goes up must come down
You up now but you'll get yours
Somehow, some day
In some way, shape, or form
Revenge is coming
No way to escape the storm

I missed you (Aw)
Missed you so bad I followed you (What, where?)
Followed you all the way to your boyfriend's rendevouz (What?)
Yeah bitch you caught now
So don't even try to give me that shit you thought how it wasn't you who I saw now (No it wasn't)
You trifling ho, I gave my whole life to you yo
And now you basically shove a knife in my throat (It's not like that)
But it's alright though, the same cat you was fucking with then
Is currently laying dead in the trunk of my Benz (Oh God)
Yeah get to crying, in a minute you'll be there beside him
And by the time the cops find you I'll be in the islands (No, I'm sorry)
Visualizin' what could have been between me and you
It was just just a dream, you fucked up the thing between us two
So now it's speak your peace before you leave this earth bitch (We can work this out)
I hope that shit was worth it
And now I pray that God is merciless
With this said, goodbye to the reason I lived this life (Shawn)
Pointed the gat to her mouth, long kiss goodnight (No)

What goes around comes around
What goes up must come down
You up now but you'll get yours
Somehow, some day
In some way, shape, or form
Revenge is coming
No way to escape the storm
What goes around comes around
What goes up must come down
You up now but you'll get yours
Somehow, some day
In some way, shape, or form
Revenge is coming
No way to escape the storm"
207,Crooked Smile (Original),Revenge of the Dreamers ,en,"They tell me I should fix my grill cause I got money now
I ain't gon' sit around and front like I ain't thought about it
A perfect smile is more appealing but it's funny how
My shit is crooked look at how far I done got without it
I keep my twisted grill, just to show the kids it's real
We ain't picture perfect but we worth the picture still
I got smart, I got rich, and I got bitches still
And they all look like my eyebrows: thick as hell
Love yourself, girl, or nobody will
Oh, you a woman? I don't know how you deal
With all the pressure to look impressive and go out in heels
I feel for you
Killing yourself to find a man that'll kill for you
You wake up, put makeup on
Stare in the mirror but its clear that you can’t face what’s wrong
No need to fix what God already put his paint brush on
Your roommate yelling, ""Why you gotta take so long?""
What it's like to have a crooked smile

A crooked smile
A crooked smile
This crooked smile

Listen
I got a story for ya, when I was seventeen
I had a name, was far from lame and that meant everything
I hit the club with my nigga Ced. ain't nuttin' new
But on this particular night that we was coming through
Niggas was on the stage, battlin' babblin'
Going nowhere, I figured, ""Fuck it, there's a couple hoes here""
I might as well sign up and climbed up the stage
I went first, I kicked my verse, spit like a lion out the cage
The crowd feeling my rage, I aired the nigga
Tossed the mic right to 'em like I dared the nigga
Thought I scared the nigga, DJ started the beat
His heart started to beat fast, the part of defeat
The nigga verse was weak, that is until he said this
""You ain't So So Def, your teeth just got Jagged Edges""
Damn, that was the dagger that killed my swagger
I never hit that stage again, I begged my mom for braces, then I had a

Crooked smile
A crooked smile
A crooked smile
A crooked smile

Growing up was just a young knucklehead running wild
Momma youngest, e'erybody knew I was the problem child
Front teeth missing in my smile, snaggletooth nigga for a while
Liftin' up my pillow, tooth fairy never came around
Damn, we was po', but I ain't know
Mouth open at the mirror daily, look and wonder how my teeth'll grow
They came slow and out of line, I couldn't comprehend
The significance at the time, this crooked smile
Was just another sign saying life ain't fair
Some niggas had the perfect smile with the nice wave hair
Oh yeah, remember Brandy? Loved her like candy
She went with my nigga, Sosa, I was scared to approach her
That nigga had the fresh new gear, J's drop
He got a fresh new pair, and there I was with hand-me-downs
Turn into the class clown, teachers couldn't stand me now
Defense mechanism, lookin' for attention

With this crooked smile
This crooked smile
This crooked smile
This crooked smile

""Crooked Smile"". You know what it is. This is for those that's—that's not picture perfect, but we still worth the picture, you know? As I sit here and sip this Corona. Ayy, shout out to Brandy, man. I—I still got love for ya. I'll never forget, we was in the fifth grade, maybe it was later than that, but remember we was at the  we had the orchestra thing and you told—you told a white girl, you told her to tell me that if I went and got some braces that you would go out with a nigga and shit. Ah, those were the days. I still got love for ya. You know shit like that made a nigga tough"
208,Dead Presidents,The Come Up Mixtape Vol. 1,en,"(Is that what you want?)
Let me try again (Uh), yeah
(I'm out for presidents to represent me)
Money coming soon
I'm out for presidents to represent me (Omen, what up, nigga?)
And you know why his name on point 'cause he on point, pussy
Yeah (Nigga), uh

Give me my money, man, why else would a nigga be grinding? (Right)
Out for them diamonds, dog, how else could a nigga be shining? (True)
I'm glowing, knowing that the flow intact
Get this record deal, I swear to God, my first mil', I'm blowing that (Haha)
Like fuck it, I know I'll grow it back, shit, it's nothing
Funny how Blacks spend they dough on mad shit for stuntin' (Yeah)
But shit, that's all we know man, that's how a nigga's raised (True)
You learn 'bout two things, getting pussy, getting paid (Uh)
And you should be gettin' laid by the time you in ninth grade
So niggas lying on they dick and hoes giving nice brain, yeah
In class, dreamin' 'bout having these nice things
And then you look around and wonder why you strugglin', but them whites ain't (Hmm)
I brush it off, like, ""Fuck it, it's motivation"" (Yeah)
Some niggas gotta walk through life, some niggas roller skatin' (Uh)
Some niggas bypassing steps, some niggas chose to take 'em (Yeah)
And for that fortune, man, some niggas sold their soul to Satan
But fuck it, man, I ain't hatin,' I gotta go for mines
My little godsister pregnant now, I put in overtime
On my grind (Yeah), like a nigga making Folgers
I'm focused on my bite like a cobra, I'm tryna get my Oprah on
These hoes is crying 'cause I won't pay 'em attention (Nah)
Time is money, bitch, and a nigga payin' tuition (Haha)
Real niggas hustle by using their intuition (Yup)
While these fake niggas ain't about doing, they into wishin'

Uh, 
I'm out for presidents to represent me
 (Yeah)
I'm out for presidents to represent me
 (Uh)
I'm out for presidents to represent me
I'm talking Benjamins, nigga
I'm out for presidents to represent me
Grants, nigga (
I'm out for presidents to represent me
)
I'm out for presidents to represent me
 (Peep them Washingtons, man)
Tired of those (Yeah)

Until I'm rich, ain't no reason to settle, nigga, it's greed
That make a nigga wink at the devil to get the cheese (Yeah)
You niggas couldn't think on my level, weavin' with trees
You couldn't get this deep with a shovel, now nigga, please
I'm chasing G's, tryna throw some diamonds on them freeze
Sick shit, sneeze on some thousand-dollar sleeves
Ease to the top and I'm not finna leave 'til I'm hot
But my watch got a breeze, a south nigga
Boy, I'm shining without the diamonds in my mouth
Out grindin' while you reclinin' on your couch
I'm climbing, you haters blinded by the doubt
My niggas riding is devout, so talking violence out yo' mouth
And you gon' find what I'm about, nigga
Far from a slouch, nigga, I ain't gonna parlé with y'all
I'll probably hit ya, my hand game like Bobby Fisher
But check, them checks is all a nigga thinking
For them Presidents, I'll treat a nigga like Lincoln, blaow

I'm out for presidents to represent me
 (Yeah)
I'm out for presidents to represent me
 (Definitely out for presidents to represent me, nigga)
I'm out for presidents to represent me
Money coming soon

Mike Charles, what's good?
Nervous Reck, what it is? Ayy
Barbed Wire, what's good? Filthe Ritch, what's good?
Germ, you out, baby
I ain't made it home yet, I'm coming soon, my nigga
Gotta get up out by your dream, you know?
You know your boy dreamin' now, easy
We went here since I was like what? Sixteen, nigga, fifteen
I'm twenty-one, I'm a grown-ass man, shit didn't change, homie
Money is coming soon, trust me, nigga
Trust me, nigga
I'm all growed up"
209,Bring Em In,Any Given Sunday #2,en,"I wadn't lookin' for ya, I wadn't searchin'
I wadn't creepin' around, I wadn't lurkin'
I wadn't sleepin' around, I wadn't thirstin'
But I got a thang for ya, I got a thang for ya
You on ya job and it's damn sure workin'
Say she ain't a ho, but she far from a virgin
When it's time to cut, I'm somethin' like a surgeon
I do my thang for you
Hey, baby girl you gotta trunk, I might put you in valet
Way you stretching make a man think I put you in ballet
If I'm sliding through your city, I need you to dial me
And how much my niggas smoke reminding you of Friday
I can take you to DC, introduce you to Wale
You can look all through my phone as long as you don't call Jay
Is it cool to parle, we can do this all day
Just me and you off in my room, we call this do the hard way, hard way

I put it down, any spot, any city that I'm in (Hey)
Let the bad girls know we run the town
So pick up that cellphone and tell a friend
To tell a friend, I put it down
Any spot, any city that I'm in (Hey)
Let the bad girls know we run the town
And my niggas blow trees like the wind, so tell a friend

To bring a friend and bring 'em in
Bring 'em in, bring 'em in
And if they all bad you can bring 'em in
We take it to the grr, it's just you, me, and them

Now bring ya ass over here
A nigga tryna take you home like a souvenir
One in a million, girl, you lookin' like you knew Aaliyah
And ah, I got a thang for ya, I got a thang for ya
A stewardess and yet you flew the leer
'Cause you're fly as hell, shawty walking through the air
Game cold like the toes on a polar bear
And ah, I do my thang for ya
Now baby girl if looks can kill then you catchin' bodies
How I'm stretching you, guess no need to go get pilates
When I'm sliding through ya city, meet me in the lobby
And you put that thang up on me like you tryna rob me
Can I hit it in the mornin' while you moanin'? Prob'ly
Got you sweatin', now you gettin' wet as a tsunami
We can do this all day, treat it like a hobby
But if I tell you get to stepping like you Pam and Tommy, don't mind me

I put it down, any spot, any city that I'm in (Hey)
Let the bad girls know we run the town
So pick up that cellphone and tell a friend
To tell a friend, I put it down
Any spot, any city that I'm in (Hey)
Let the bad girls know we run the town
And my niggas blow trees like the wind, so tell a friend

To bring a friend and bring 'em in
Bring 'em in, bring 'em in
And if they all bad you can bring 'em in
We take it to the grr, it's just you, me, and them

Did I meet you for a reason or for a season
Or either the night of ya life at the Four Seasons?
Whisper to ya home girl you love Cole World
'Cause his flow thorough, I give you a few more reasons
Not because his verse or 'cause I can buy purse
You know, the type of shit your man could only purchase on the first
And not because he faker than turf, softer than Nerf footballs
I got his girl's lip gloss all on my girth
Because I'm so clever better than ho-eva
The coldest nigga even when wearin' like four sweaters
Well versed, well rehearsed, the go getter
These broke niggas got good dressing and no lettuce (Argh)
You would think niggas would know better
It's oh-eleven, you would think niggas would flow better
I know you're so fed up
And so I had to blow and I ain't talking coke header, I won't let up

I put it down, any spot, any city that I'm in (Hey)
Let the bad girls know we run the town
So pick up that cellphone and tell a friend
To tell a friend, I put it down
Any spot, any city that I'm in (Hey)
Let the bad girls know we run the town
And my niggas blow trees like the wind, so tell a friend

To bring a friend and bring 'em in
Bring 'em in, bring 'em in
And if they all bad you can bring 'em in
We take it to the grr, it's just you, me, and them"
210,It Won’t Be Long,,en,"Uh, yeah
I said it won’t be long (no)
‘fore we out here baby
Gotta get you up out here baby
Said it won’t be long
‘fore we out here baby
We up out here baby

I say a prayer and look up in the sky
Thank God even though a nigga headed to this tired day job
Will my eyes stay wide still I know I’m gonna blow
This is music for my niggas cause I know you want more
Cause that old shit fake but this new shit real
J. Cole not Jay but this that Blueprint feel
Hey Cole is you crazy that's some big boots to fill
Yeah straight out the Ville and the shoes fit well
Seen heaven, seen hell, seen niggas get killed
Knew every detail still never would tell
Scared of the repercussion, scared of them people bussin'
Bullets be hittin’ nigga’s you swear they could be percussion
Niggas be holding triggers before they could read instructions
Oh God, never did our fathers teach us nothing
No law, but became a man on my own
Showed my momma I could stand on my own


Dear mama, your son hurting
Living in this cold World where niggas shun virgins
And praise hoes
As days go by shawty 19 years old
No clothes for her baby yet she stay so fly
Tell me why mamma do you cry
Is it cause you know my teacher be feeding me lies
Is it cause you know that Preacher is greedy inside
Cause racism is alive I see the disguise
Mamma I know it hurts
It hurts me to watch you go to work barely hanging on
Some rich man getting richer while you slaving for him
So whats the options for him
A young nigga from the hood without a pops at home
Surrounded by no good
And soon no good becomes so good quick
A little drug money got him feeling so hood rich
Killing your hood with the same shit Ronald Reagon filled up your hood with
And it’s still in your hood shit
I’m feeling no good mamma
I’m sick of my soul
Is there a better life for us I just sit and I hope
I just hope and I pray
It’ll change one day I’ll make a change one way
And mamma I can fly you out this cold world
This cold life, it’s all wrong
There’s no right
Its hard to see the good when there’s no light
Just grab onto me, trust me hold tight!

I said it won’t be long (no)
‘fore we out here baby
Gotta get you up out here baby
Said it won’t be long
‘fore we out here baby
We up out here baby"
211,Shock the World,,en,"Uh uh, hey, uh uh, hey
Uh uh, hey, uh uh, hey

Life make a nigga wanna yell out
Change for that fame, how some niggas turn sell out
Too old for my mama crib, I'm tryin to get the hell out
Stayin' out these cells, but we working on that bailout
Help out, please
Sure is hard livin' without cheese
Ain't shit in my pocket, only these house keys
They pray for a nigga but yet they doubt me
That's why I'm out getting higher than balconies
But no I won't jump, being broke is childish and boy I'm grown up
My money runnin' late though, so boy I won't front
When my paper finally make it, you should know I'm gonna stunt
So, hard

My God, my life is such turmoil
Can't save me tonight 'cause times is hard now
I know you tell me don't let my guard down
I gotta get it my nigga

Never believe what they say
Man, I gotta get paid
Dawg it's so damn amazing
How I'mma shock the World
I'mma shock the World
Hell nah, I ain't lying
Yea, I gotta get mine
Dawg it’s about time
So I'mma shock the world
So I'mma shock the world

Stare inside of the soul of Kendrick
While I stare inside the solar, system hopin' I soak up
Enough game to play 3 systems with one controller
And remain sane and remain unsober
Was closer to my dreams but reality actually told me, hol' up
No money in my jeans and my salary said you owe us
Can't pay them taxes, laid on that matress and feel colder than a polar bear
But this bear was in California
So I felt outta pocket and then a piece of lint fell out my pocket
A broke opportunist all in my optics
And you could see it even when I'm asleep
My screw's loose, I hate when loose change fall in them seats
Because I need every dime like Magic Johnson
Or Hugh Hefner living in his prime
Prime example of youngin' on his grind
This the life of a Compton nigga
I know the vanities of the world like the promise niggas
That's why we crooked, in your bushes where you find us nigga
You better scramble before you fold like an omelet nigga
This ain't insomniac nigga and that means I don't need Busters to front on me
A Bible in my pocket I'm walkin' like it's a gun on me
So when I catch a fade they know to put more than one on me
Fear no evil, I can still see Regals pullin' up
Niggas tuck like a baby in fetal, position
If you listen you can hear the city needs you
That's what my mind said
But my big head is tellin' me that I'm a black Beatle
Until my number is called and someone yell bingo
A shadow in the dark, park the coupe
Then recoup with the homeless in the park, Kendrick Lamar"
212,Rags to Riches (At the Beep),The Come Up Mixtape Vol. 1,en,"Your call has been forwarded to an automated voice messaging system
(DJ OnPoint)

Damn, broke as a bad joke
But still I laugh though, frontin', tryna have hope
It's sad though, I'm tired of being broke as shit
I'm seein' other niggas ballin', I'm like 0 for 6
And man, I just graduated, good old college degree
Shit, my niggas drug dealing see more dollars than me
I know my calling, it's in my blood to do this music thing
Won't be that illest nigga that you never knew his name
I'm looking at these fake A&R's like, ""You a lame
That boy a genius and you ain't even listen, man, you insane""
But you'll see though
Just what the hell a nigga 'bout to be though
So give me one year then play this back like TiVo
'Cause, boy, I'm finna blow, I'm a motherfuckin' torpedo
The music's in my blood, so watch these niggas turn mosquito
Uh, I play the villain and the hero, some grow man shit
Feel like a goddamn kid, man, I'm Pac and BIG (What up?)
Up is something that I can't give
Won't see me disappear like the old Aunt Viv'
'Cause even on a slow jam, I'm so damn sick
Man, I even spread a virus to a program, quick
I gotta focus on my flow and get some dough, man, shit
No dollars got me actin' like I got no damn sense
But peace to my broham's and to my ex-lady
Yeah, we been complicatin' things with the sex lately
Maybe I'm being selfish, but nah, I can't help it
'Cause girl, we go back like a throwback Celtic
Jersey, regardless of where God lead us
Just know that I was Martin and you was my Gina
Uh, but I'm through living in the past, Lord
No more thinking rewind, I'm more fast forward
Less rear-view mirror and more dashboard
I'm visualizin' cash and stamps on a passport
That CLS with a full tank of gas for it
Copped my mom a whip, nigga, and she ain't even ask for it
Wise enough to know that money can't buy you happiness or lovers
But it's gon' get my mama out the struggle
I'm wise enough to know that money can't buy you happiness or lovers
But it's gon' get my mama out the struggle
Said, I'm wise enough to know that money can't buy you happiness or lovers
But it's gon' get my mama out the struggle

Nigga
Yeah, uh, uh-huh
I'd like to welcome y'all to
My life, my life, my life, my life, in the sunshine
Okay, in the sunshine
Okay, yeah
Everybody loves the sunshine
This is The Come Up, nigga, uh
Sunshine
Ayo, real quick, man
Everybody loves the sunshine
Y'all been a part of this experience, man, The Come Up
While we gettin' out of here, I just wanna give a few shout outs, man
Sunshine
First and foremost, man, my fam, man, my mother, my brother, man
Folks get down in the sunshine
God, nigga, yes, God, nigga
For real, my brothers from another mothers man, RJ, man
Sunshine
Mike Shaw, what it is, man? Dreamville all day, we not
Folks get down in the sunshine
We callin' that shit Fayettenam, nigga
But we also callin' that shit Dreamville
Nigga, you got a dream, you can get the fuck ‘bout out of your situation, nigga
Shout out to By Any Means, my nigga Ebro, man
Them two nice niggas, man
All the way, all terrain music all day
Just bees and things and flowers
It's a beautiful life, man
From rags to riches, watch me, man
Just bees and things and flowers
From rags to riches
Shout out the whole North Carolina
Yeah
Just bees and things and flowers
Uh, yeah
You just experienced 
The Come Up
DJ OnPoint, J. Cole"
213,See It To Believe It,,en,"The songs that I made in my bedroom and shit
Finally give a nigga leg room and a whip
Yeah Cole World, make way for the chosen one
Ain't nobody else I’d rather be, not even Oprah’s son
Momma’s youngest gettin' paper like the oldest one
We livin' better, guess God felt he owed us one
Closets barely had no clothes in them
So you throw my niggas in hoopty
But we still bag hoes and them
These niggas give they heart and soul to them
I wonder if they know we dovin' them
Ass fat so when pinch ‘em like a Doberman
Run up on em politicking like Keith Olbermann
What’s your name
Where ya from
Ya got a dream
I’ll sell ya one
Come and kick it with a nigga on his way to the top
Won’t stop, won’t stop
Hey and don’t stop
Now if it don’t jam the hoes won't rock
And if it ain't crack then the fiends won't cop
And you wonder why a nigga got the shit you don’t got

Gotta see it to believe it
Gotta see it to believe it
Gotta see it to believe it
And don’t stop
Now if it don’t jam the hoes won't rock
And if it ain't crack then the fiends won't cop
And you wonder why a nigga got the shit you don’t got
Gotta see it to believe it
Gotta see it to believe it
Gotta see it to believe it

There’s so much pain on my brain I gotta jot it out
But as of late nigga, it ain't been shit to pout about
I turn up the news, my blues seem petty
Cause my view of the city is incredible with no album out
I’m blessed nigga, I’m blessed
When I’m all alone these words just flow out of my chest
Turn ‘em into poems, they worship, I’m the best
And though I’m takin' long
They fuck with me none the less
Yeah, enough sleepin'
I put you niggas to rest
The only one sayin' shit is like a nigga got tourettes
Unimpressed with you niggas
You the shit only cause I digested you niggas
But I digress, boy you bout as G as a fucking tie dye vest
And your wifey is a bird even in her Prada dress
Want a nigga like me to come and get her out her nest
Like come and kick it with a nigga on his way to the top
Won’t stop, won’t stop
Hey, dont stop
Now if it don’t jam then them hoes won't rock
And if it ain't crack then the fiends won't cop
And you wonder why a nigga got the shit you don’t got
Gotta see it to believe it
Gotta see it to believe it
Gotta see it to believe it"
