,Title,Album,Language,Lyrics
138,Drum n Bass,The Fall-Off,en,"Get the fuck up out my face with what you talkin' 'bout
I got too much on my plate, and I know you can't relate
They show love, but it be fake, fuck you talkin' 'bout?
Shit be coverin' up the hate, I know how to spot a snake
Niggas tote that drum and bass, fuck you talkin' 'bout?
So you better know your place, stay inside 'cause it ain't safe
Bitch, I'm outside with the eights, fuck you talkin' 'bout?
Yeah, uh

You hear my words, but got no clue 'bout who I really am
From shark-infested waters
Phrases like that make me sound harder and more ruthless, but the truth is that I merely swam
Out thе stolo, semis blam
Willy-nilly over killy grams
Niggas sellin' rock likе Steely Dan
While the world spins like whirlwinds
Out of control, how does the soul find a thorough cleanse
When all of this cold water that flows has for sure been contaminated with sin?
Planted in the latest of trends
Stranded in this land of the antiquated ways of the men
Standard in the state of revenge, seekin' a way to defend
Reputations, because the names are actually greater than them
Life is a trip, you can't predict the random way that it ends
Bullets travel straight through the skin like gamma rays in the wind
My greatest of wins came when I annotated my gems
The shit I write so fire, I got my hand afraid of my pen, uh

Get the fuck up out my face with what you talkin' 'bout
I got too much on my plate, and I know you can't relate
They show love, but it be fake, fuck you talkin' 'bout?
Shit be coverin' up the hate, I know how to spot a snake
Niggas tote that drum and bass, fuck you talkin' 'bout?
So you better know your place, stay inside 'cause it ain't safe
Bitch, I'm outside with the eights, fuck you talkin' 'bout?
And tell me, what sense do it make comin' back when you escape?

Quiet as kept, I feel the vibe of the whole city so tired and stressed
From gettin' fed this steady diet of death
Mothers cryin' on steps while porch lights shine down
On a giant puddle that now forms on the ground as she wept
Family surroundin' her, providin' their best attempt at consolin' her
Prayers and words of faith, comin' out of their breath
Turning to the Lord's ironic at a time
When these young niggas so violent, they'll let off at God in the flesh
My mind is a mess, conflicted, 'cause their energy's wicked
Their need to impress at a high while their guidance is less
And while I feel powerless to change the power that is
A part of me is yellin' loud as shit, ""You ain't tryin' your best""
Too busy sellin' out arenas and flyin' on jets
Life on cloud nine and I can't deny it, I guess
I'm livin' my dream, my life is my childhood wish
The guilt that comes along with that is the size of the rest
Of the planet, I pray you get to see it across the Atlantic
Tonight, I stepped out with my niggas and felt the organic
Nostalgia that arouses when I'm with the rest of the bandits
Obsessed with talkin' 'bout the bitches we sexed 'til we landed
In the spot that always used to pop when we was younger
Shook hands with niggas I hadn't seen for several Septembers
Gave hugs to women I only vaguely remembered
The way their fingers caressin' my back was givin' me signals
Like, you may enter, liquor informin' my agenda
Straight and narrow for a while, but tonight, I'm on a bender
And my retina antennas are scannin' the club intently
For the girl I wanted bad and almost had before the Bentley
But evidently, when you're the greatest rapper of the century
You'll get another shot, the club was startin' to get too hot
So I stepped outside for a breather, that very moment, I seen her
She had the glow of Aaliyah while I control my demeanor and said

(Oh, shit, that's Cole right there)
Damn, what's good? How you been? (Ayy, Cole, what's good, bro?)
(
Ayy, let me, uh, let me holler at you for a second, bro
)
Yeah, that's cra— yo, one second, bro, one second, I got you
Nah, that's crazy like (Word?), that's crazy (Yo, I just wanna— I just wanna holler you out quick, bro)
I was wondering too like, I ain't know if I was gon' see you or what I was— (Man, it ain't gon' take but a second)
Yo, one second, bro, I got you (Oh, word?)
I'm just talkin' to her, right now (Oh, aight, aight)
Hell yeah (
We'll see 'bout that
)
You gon' be here for a minute? Aight

Get the fuck up out my face with what you talkin' 'bout
I got too much on my plate, and I know you can't relate
They show love, but it be fake, fuck you talkin' 'bout?
Shit be coverin' up the hate, I know how to spot a snake
Niggas tote that drum and bass, fuck you talkin' 'bout?
So you better know your place, stay inside 'cause it ain't safe
Bitch, I'm outside with the eights, fuck you talkin' 'bout?
And tell me, what sense do it make comin' back when you escape?"
139,Cheer Up,,en,"Hey, uh, hey, uh

Even through the joy I feel the pain
Even in the sun I feel the rain
Even when I’m high I feel the lows
Like that's all I know, huh
And Lord knows I can't complain
But even when I do it feels the same
I’m getting high just to fight the lows
Cause that's all I know

Yeah, school girl, cool girl
You dressin' sexy and your mama is a cougar
So she let you do the grown folks thang
Let you hang with them boys and they play you like a fool, girl
You got your new hair, it look so good
You write the same nigga's name in your notebook
You know the same one from class, the one you let smash
Now you see him 'round school and he won't look
Now girl you is fine, ain't no doubt about it
But why else you think he hit it and forgot about it?
That's 'cause your mind don't match what your ass got
But cheer up, you gotta be your own mascot
You see you're lookin' for a man like you need somebody
Get your ass off of Twitter, you could be somebody
A doctor, a rock star, baby live life
But you rather wet up all your pillows all night thinking...

Even through the joy I feel the pain
Even in the sun I feel the rain
Even when I’m high I feel the lows
Like that's all I know, huh
And Lord knows I can't complain
But even when I do it feels the same
I’m getting high just to fight the lows
Cause that's all I know, uh
That's all I know, that's all I know
That's all I know, uh, that's all I...

Hey cheer up! Uh
Ey lil' mama, cheer up! Uh
You got your whole life to live, ey why you wanna tear up? Uh
Don’t let them lil' boy come but do some when they try push up
Hey, hey

Yeah, I wake up in the morning and I ask myself
Is life worth living, should I blast myself?
Don't even wanna get out the bed
I got the Glock to my head, feel I rather be dead
Hey, am I hopeless? Raised with rats and roaches
Never liked them teachers, couldn't stand my coaches
Ask ""what's the matter?"" but you can't relate
Living a life that you hate but you can't escape
Feel like I’m stuck here, that's why I don't give a fuck here
There's no luck here, nobody to trust here
My own mother, yeah I love her
But things I heard as a child under my covers
Left me with scars, it was hard to see her suffer
Darkened my heart and I don't know if I’ll recover
I'm going under and as I'm headed out the front door
She said she proud of me and I wonder what for?
And once more

Even through the joy I feel the pain
Even in the sun I feel the rain
Even when I’m high I feel the lows
Like that's all I know, huh
And Lord knows I can't complain
But even when I do it feels the same
I’m getting high just to fight the lows
Cause that's all I know, uh
That's all I know, that's all I know
That's all I know, uh, that's all I...

Hey cheer up! Uh
Ey lil' mama, cheer up! Uh
You got your whole life to live, ey why you wanna tear up? Uh
Don’t let them lil' boy come but do some when they try push up
Hey, hey"
140,Quik Stop,The Fall-Off,en,"We need to change our ways, doin' the same thing we did yesterday
Making beats, gettin' high, chasing freaks, feelin' fine
It's still the same old shit (The same old shit), but I think we ain't gon' quit
Makin' a rhyme, climbing a hill, stayin' alive, tryin' to live
(Once in a while, I get in my head too much) Just tryin' to live
(And that's when I call, hoping you'll appear, God) That's all it is

Brr, brr
The voice message—

Bruh, how the fuck you got so rich and yet, you wear the same fits
And pair of sneak's like every week? 'Cause I don't care to change shit
I'm likе a creature of habit, plus, what's the point burnin' brеad
When like a creak in your attic, I still be turnin' your head?
Just to confirm if that dreadheaded, tall fella is Cole
I try to walk with the hoodie, whether the weather is cold
Whether the weather is warm, it's just to cover the form
When doin' regular things, try to repel gettin' swarmed
But yesterday, I was drivin', 
Trap Muzik
 album did blast
Took me back to a time when I was down in my last
Was rappin' T.I.P. rhymes, then I looked down at the dash
Oh shit, I'm trippin', reminiscin', damn near ran out of gas
I pulled into this lil' station that I had seen on the ave'
In a peculiar hood, in unfamiliar paths
I got no hoodie, it's bad, hopped out and went to the pump
I pushed the 93 button, felt like a sitting lil' duck
While lookin' over my shoulder, I heard this dude on the corner
Sound like he talkin' to me, ""Ayy, bro, you smoke marijuana?
I got that pack if you need and I can smell the aroma""
I told him, ""Nah, I'm aight, I never once was a stoner""
The tank was taking so long to fill up, I thought it was broke
Could feel the curiosity comin' from buddy that spoke
Right then, he start to approach, ""Hey, bro, you look real familiar""
I said, ""I get that a lot,"" as he got close, it got clearer
""Oh shit, that's Cole, nigga, wait, what you doin' over this way?
Bro, I was just thirteen years old when I got hold of your tape
I tried to put niggas on, but they was slow to go play
Bro, you the GOAT, they didn't know then, but bet they know it today
I need a flick right quick, 'cause dog, I don't even know what to say
To make a dollar bill right now, I'm out here throwin' bouquets
Slangin' flowers, but I played your albums and know it's a way
I played your shit when bro got hit, it helped me cope with the pain
I played your shit when momma tripped, and I had nowhere to stay
I swear I feel like you was with me in my loneliest phase""
The love he showed me was so strong, it damn near blowed me away
See, even I be needin' reminders on my loneliest days
That I should live in my purpose if I deliver my verses
And get the fuck out my way, I'll figure out what to say
Some days, I forget to eat, some days, I forget to pray
I get a whole lot of love, some days, I focus on hate
I took a selfie with dawg and gave the longest embrace
Then look him right in his face to let him know that this thanks
Was from a genuine place 'cause this continuous race
To be the best will leave you steppin' at a strenuous pace
'Til you forget who you is and you forget who you ain't
Before you know it, you're trapped inside that picture you paint
This life is more than just rap, more than the bitches you scrape
More than the riches you stack, see, it's the difference you make
Yeah, it's the difference you make
Yeah, it's the difference you make
Yeah, it's the difference you—

We need to change our ways, doin' the same thing we did yesterday
Makin' beats, gettin' high, chasin' freaks, feelin' fine
It's still the same old shit (The same old shit), but I think we ain't gon' quit
Makin' a rhyme, climbin' a hill, stayin' alive, tryin' to live
Just tryin' to live
That's all it is"
141,Stay (2009),Truly Yours,en,"Stay
Yeah
Hey
Groovy
Yeah
Yeah, hey
Stay

You can drop a ""Wet Floor"" sign down for the tears
God and my court date, the two things I fear
Man, they tryna give a nigga years
I'm tryna figure if I should even appear
Or should I skate town? Catch a Greyhound
Change my name right, catch a plane flight
Out the country, let them muh'fuckers hunt me
Come catch me if you want me, know they'll lock me if I stay (
Stay
)
But where I'ma run to?
I got a good girl, we got a son, too
And all we went through, we ain't see eye-to-eye
But what you told me way back, you was a ride-or-die
So if they give me one, or if they give me two
Or if a nigga gotta sit down and do a few
Before I go, baby, I gotta know, what would you do?
Would you find someone new or would you stay? (
Stay
)
Like the hoes when they lay with me
Puppy eyes when I go sayin', ""Stay with me""
Aw, girl, you bad as hell and, yeah, I'd love to
But see, I got a girl I'm really makin' love to
Therefore I'm feelin' a lot more guilty when I rub you
That's why I skip all of that kissin' when I fuck you
Flush the condom down the toilet then I skate
I had you, but you can't have me, I never stay

Stay
Yeah
Yeah, that's the one
(Stay)
Yeah
Stay

Ha! Life in a hometown
'Fore I could take a step, I'm gettin' grown now
And startin' to notice that I see the same hoes 'round
Guess they had to go 'round, my raps is profound
I got the flows, but yet a nigga ain't got no sound
Copped a beat machine, I'm cookin' up my own now
Got my mind on the city where it goes down
See, if I'ma get to where I'm goin', then I can't stay (
Stay
)
Although I love it here
I'll be damned if I sit around another year
Dreamin' dreams, hopin' somehow that they just appear
The hardest part of leavin' is to know my mother here
Oh, but I'm comin' back, oh boy, believe that
To show the little niggas, boy, you can achieve that
Got the city on my shoulders, piggyback
Hello, my name is Cole and I'm here to stay

Stay
Hey
(Stay)
Stay"
142,Tears for ODB,Truly Yours,en,"Tears for ODB, drug-induced poetry
What's the use? Strung-out from that drug abuse, woe is me
80's baby, so I know my pops was gettin' high
In the 90's, me and mama barely gettin' by
2000's I was concentratin' more on gettin' fly
Gettin' bitches, gettin' rich to get the shit I couldn't buy
You know the story, you know my allegory
I was sent from Heaven with a set of horns, they'd better warn y'all
I'm here for more than just to kick some witty metaphors, dawg
This more of the type of shit you spit to set a war off
'Cause niggas be poor, get money and still don't know
Why the fuck they can't cop a house, the system meant to lock us out
But I'm knockin' down the door, strapped up with a four-four
Robin Hood, shit and yeah, I'm 'hood rich
That's good enough to stay in new kicks and a good whip
Get good head from a good bitch, I give two shits, I'ma tell you straight up

Straight up
Straight up, aye, any chance I'ma take it
Rather die before I fake it
They say life is what you make it, bitch
But I'm just tryna make it
Straight up
Straight up
Straight up, aye, any chance I'ma take it
Rather die before I fake it
They say life is what you make it, bitch

Lord have mercy on my soul, what I've done and what I've seen
My life has tumbled into that which only you could intervene
I put my heart in senseless things: money, bitches and street shit
Fascinated by beef, sad to say I won't be shit
Grew up in this bitch without a pot to piss, no toilet
How ironic, I took a lot of shit, like a bottom bitch
Or a model chick, high off coke
They lockin' sons up for less, I don't care how y'all cope
But yet I still peddle this dope and these pills
I'll never know how sittin' comfy on that Oprah seat feels
More than likely be on Most Wanted posters, we still
Holdin' on to old dreams of bein' Hova, be real
We the forgotten souls, bottom of the totem poles
Left for dead, some niggas fled, people say they sold their souls
I just think they found a better way, Lord knows I never pray
But sometimes I be wishin' I could levitate, I'll take it straight up

Straight up
Straight up, aye, any chance I'ma take it
Rather die before I fake it
They say life is what you make it, bitch
But I'm just tryna make it
Straight up
Straight up
Straight up, aye, any chance I'ma take it
Rather die before I fake it
They say life is what you make it, bitch

Hey, hey
Cole World
2-6 Fayettenam shit
For all my niggas still going through it
Yeah
Straight up
My niggas gotta learn something
It's 2012 nigga
And we're still killing ourselves
You don't know by now nigga
You ain't gon' never know
Real"
143,The Autograph,Friday Night Lights,en,"Just turn the beat down just a little bit
Hey
Yeah

They say anything's possible
You gotta dream like you never seen obstacles
Chasin' obscene profits, so we ain't stoppin' for the red lights
Look in my rearview, all I see is niggas' headlights
Catch me if you can, ho, they try and sack me and I scramble
Look up in the sky, you'll see exactly where I am, bro
Ayy, don't you see me, man?
Makin' my wishes come true with no genie, man
I got the keys to my Bimmer with no Beenie Man
I'm on these rich niggas' ass, no bikini, man
I bring the real 'til the day the Lord free me, man
Never imagined that the kids would want to be me, man
Ayy, could it be I give the hopeless broke kids hope?
Caught me walkin' through the mall, lookin' like he seen a ghost
Simply had to approach, ""What's up, young blood?"" Ayy, ain't it strange?
A year ago today, my nigga, I was countin' change
Yeah, hoppin' trains up in New York City
Know I gotta thank God 'cause if You weren't with me
Then I surely woulda died, you can throw the fork in me
This my New Year's resolution, dog, no more pork in me, uh
I ain't no Muslim, though
Caron Butler, I'm a wizard if you doesn't know
It's young Simba, yeah, I'm ballin' 'til the buzzer blow
You's tryna kick the shit I kick, man, you gon' stub your toe
Boy, that's just how tough I go
See, this is my light work
This shit y'all callin' classic, I be like, ""That might work""
Want you to feel somethin' new, that's how a dyke work
They ask me 'bout pressure, they wanna see my pipe burst

Not tonight, nigga
Ayy, not tonight, nigga
Yeah, hey
Man, man, hey

Man, I rap so vicious, but I talk so politely
Never met a baby mama mama who don't like me
Met a couple baby fathers, though, that wanna fight me
I hit it 'til she snooze like the news, nigga, nightly
Send her back to you when she no longer excites me
Now she bitter with this nigga 'cause he ain't quite me
One thing's for certain, baby girl, you are a wifey
Two things for fuckin' sure, I am not the husband, though
So run back to him while you still can
He stickin' with his wife and kid, yeah, that's a real man
I was ashamed all along and I still am
We let the lust interrupt somethin' real, damn
Well, girl, we grown, so you gotta play your own position
I wouldn't say that you a ho, just made a ho decision
Ayy, you can blame it on the liquor like a prohibition
We both know that's what you wanted, girl, I know you're listenin'

Hey
Girl, I know you're listenin'
Uh, I know you're listenin'
Hey, yeah

Shout out to the bootleggers who supplied my shit
The fans online tryna find my shit
And to them niggas listenin', but won't buy my shit
Then catch me in the street and wanna ride my dick
Y'all niggas is the worst, see me
Like, ""J. Cole, homie, could you sign my burnt CD?"" Nigga, please
An album ten dollars, you act like it's ten G's
This food for thought cost the same as two number threes
So at ease with that broke shit
We all tryna get a dollar, boy, no shit
You know I feel your pain, therefore I slang this hope shit
And give you lines that you rewind and think, ""Oh, shit""
These rappers talk a lot of money, cars, and hoes shit
I give you that and then a whole lot more shit
That got rich and still rappin' like I'm poor shit
You niggas think you know shit, man, you don't know shit, ho bitch

Yeah, Cole, bitch
Uh, J. Cole, nigga
Hey"
144,Higher,Friday Night Lights,en,"Come here, I'm 'bout to take you higher
We about to set this bitch on fire
Pour a lil' gas, spark up your lighter
You might not be the one, but you the one that I desire
Come here, I'm 'bout to take you higher
We about to set this bitch on fire
Pour a lil' gas, spark up your lighter
You might not be the one, hey, uh

What up, girl? Tell me how you feelin'
You look sweet enough to make a nigga need a fillin'
If you got a man, do that nigga need a fill-in?
She said looks kill and I'm tryna make a killin'
God willin', I'll be chilling on a boat, nigga
Love is a gamble, I ain't dealin' with no broke nigga
Down in Miami with a super-ho team
Tryna bag a brother with a Super Bowl ring
Or she down in Dallas at the All-Star Game spittin' all-star game
Tryna get a nigga with a all-star name, somethin' like James
Somethin' like Wade, if you something like paid
You can fuck tonight, yeah, she sayin', ""Fuck some nice J's
What about your life savings?"" Won't spend her life slavin'
So she graduated rich-nigga wife trainin'
And if you got money, man, the head is amazin'

Come here, I'm 'bout to take you higher
We about to set this bitch on fire
Pour a lil' gas, spark up your lighter
You might not be the one, but you the one that I desire
Come here, I'm 'bout to take you higher
We about to set this bitch on fire
Pour a lil' gas, spark up your lighter
You might not be the one

What up, girl? Tell me how you been
Ain't seen you since the twelfth grade, even back then
Thought you was a cutie, though your booty mad thin
But you done got thicker on a nigga, goddamn
Hey now, I got a thing for you
It's been a long time comin', I should hang with you
'Cause, see, way back, I thought to fuck with you was impossible
Count your baby daddies now, two and a possible, uh
You still got it, though, yeah, you still got it, though
Girl, your body lookin' like a fuckin' pot of gold
You got your mean little walk with the model pose
You got your hair did, you got designer clothes
You still got it, though, yeah, you still got it, though
You got your nails did, damn, girl, you're on a roll
Do you give brains? Did you make the honor roll?
Don't worry about your man, baby, he ain't gotta know

Come here, I'm 'bout to take you higher
We about to set this bitch on fire
Pour a lil' gas, spark up your lighter
You might not be the one, but you the one that I desire
Come here, I'm 'bout to take you higher
We about to set this bitch on fire (Hey)
Pour a lil' gas, spark up your lighter (Yeah)
You might not be the one (Hey)

I get bored so fast that they won't last
But, girl, you're special like I met you in the slow class
'Cause your ass got me fiendin' for you so far
My life is like a movie, would you be my costar? Like Halle Berry
Your old nigga act like a bitch like Tyler Perry
You caught him down in Memphis cheatin' like ****
I see you like to stay up on your ESPN
If your mind is on sex, you must got ESP then
Had a crush on way back, I wasn't VIP then
But I was plottin' on you, I really wish that I'd have got to know you
Before we grew up and I blew up with these Benjamins
That way I know for sure your love is really genuine
Is you my homie? Well, show me what kind of friend you is
What if it's phony and only 'cause I can give you ends?
Too late for turnin' back, fuck it, we continuin'
Get your ass in that position I love to bend you in

Come here, I'm 'bout to take you higher
We about to set this bitch on fire
Pour a lil' gas, spark up your lighter
You might not be the one, but you the one that I desire
Come here, I'm 'bout to take you higher
We about to set this bitch on fire
Pour a lil' gas, spark up your lighter
You might not be the one"
